{
  "$schema": "https://json-schema.org/draft/2020-12/schema",
  "$id": "season.schema.json",
  "type": "object",
  "additionalProperties": true,
  "required": [
    "id",
    "round",
    "date",
    "theme",
    "season",
    "qualifier_period",
    "knockout_period",
    "status",
    "champion",
    "qualifier",
    "groups",
    "grand_finals"
  ],
  "properties": {
    "id": { "$ref": "#/$defs/date" },
    "round": { "type": "integer", "minimum": 1 },
    "date": { "type": "string", "minLength": 1 },
    "theme": { "type": ["string", "null"], "minLength": 1 },
    "season": { "type": ["string", "null"], "minLength": 1 },
    "qualifier_period": { "$ref": "#/$defs/period" },
    "knockout_period": { "$ref": "#/$defs/period" },
    "status": { "enum": ["upcoming", "in_progress", "finished"] },
    "champion": { "type": ["string", "null"] },
    "collection": { "$ref": "#/$defs/collection" },
    "qualifier": {
      "type": "array",
      "items": {
        "type": "object",
        "required": ["rank", "name"],
        "properties": {
          "rank": { "type": "integer" },
          "name": { "type": "string", "minLength": 1 },
          "time": { "$ref": "#/$defs/time" }
        }
      }
    },
    "groups": {
      "type": "array",
      "items": {
        "type": "object",
        "required": ["id", "players"],
        "properties": {
          "id": { "type": "integer" },
          "players": { "type": "array", "items": { "$ref": "#/$defs/player" } },
          "matches": { "type": "array", "items": { "$ref": "#/$defs/match" } }
        }
      }
    },
    "grand_finals": {
      "anyOf": [{ "type": "null" }, { "$ref": "#/$defs/grand_finals" }]
    }
  },
  "$defs": {
    "date": { "type": "string", "pattern": "^\\d{4}-\\d{2}-\\d{2}$" },
    "period": {
      "type": "array",
      "minItems": 2,
      "maxItems": 2,
      "items": { "$ref": "#/$defs/date" }
    },
    "time": { "type": "string", "pattern": "^\\d{2}:\\d{2}\\.\\d{1,2}$" },
    "collectionStatus": { "enum": ["pending", "complete", "missing"] },
    "collection": {
      "type": "object",
      "additionalProperties": false,
      "required": [
        "qualifier",
        "knockout_matchup",
        "knockout_results",
        "grand_finals"
      ],
      "properties": {
        "qualifier": { "$ref": "#/$defs/collectionStatus" },
        "knockout_matchup": { "$ref": "#/$defs/collectionStatus" },
        "knockout_results": { "$ref": "#/$defs/collectionStatus" },
        "grand_finals": { "$ref": "#/$defs/collectionStatus" }
      }
    },
    "grand_finals": {
      "type": "object",
      "additionalProperties": true,
      "required": ["results", "bracket"],
      "properties": {
        "results": {
          "type": "array",
          "minItems": 8,
          "maxItems": 8,
          "items": {
            "type": "object",
            "required": ["rank", "name"],
            "properties": {
              "rank": { "type": "integer", "minimum": 1, "maximum": 8 },
              "name": { "type": "string", "minLength": 1 },
              "power": { "type": "string", "minLength": 1 }
            }
          }
        },
        "bracket": {
          "type": "array",
          "minItems": 7,
          "maxItems": 7,
          "items": { "$ref": "#/$defs/match" }
        }
      }
    },
    "player": {
      "type": "object",
      "required": ["name"],
      "properties": {
        "name": { "type": "string", "minLength": 1 },
        "player_id": { "type": "string", "pattern": "^\\d+$" },
        "flag": { "enum": ["⚠", "≈"] },
        "prev_best": {
          "enum": ["1強", "2強", "4強", "8強", "16強", "32強", "64強", "未入選"]
        },
        "qualifier_time": {
          "anyOf": [{ "$ref": "#/$defs/time" }, { "const": "未通關" }]
        },
        "prev_time": {
          "anyOf": [{ "$ref": "#/$defs/time" }, { "const": "未通關" }]
        }
      }
    },
    "match": {
      "type": "object",
      "additionalProperties": false,
      "required": ["round", "slot", "p1", "p2", "winner", "loser"],
      "properties": {
        "round": { "enum": ["R1", "R2", "決賽"] },
        "slot": { "enum": ["A", "B", "C", "D", "upper", "lower", "final"] },
        "p1": { "$ref": "#/$defs/side" },
        "p2": { "$ref": "#/$defs/side" },
        "winner": { "type": "string", "minLength": 1 },
        "loser": { "type": "string", "minLength": 1 },
        "winner_power": { "type": "string", "minLength": 1 },
        "loser_power": { "type": "string", "minLength": 1 },
        "notes": { "type": "array", "items": { "type": "string" } }
      }
    },
    "side": {
      "type": "object",
      "additionalProperties": false,
      "required": ["name"],
      "properties": {
        "name": { "type": "string", "minLength": 1 },
        "player_id": { "type": "string", "pattern": "^\\d+$" },
        "progress": { "type": "integer" },
        "time": { "$ref": "#/$defs/time" },
        "power": { "type": "string", "minLength": 1 }
      }
    }
  }
}
