{
  "id": "2026-07-03",
  "round": 2,
  "date": "2026/7/3",
  "theme": "獲得飛劍和流星流派技能",
  "season": "飛劍季",
  "qualifier_period": [
    "2026-06-29",
    "2026-07-02"
  ],
  "knockout_period": [
    "2026-07-03",
    "2026-07-10"
  ],
  "status": "finished",
  "collection": {
    "qualifier": "complete",
    "knockout_matchup": "complete",
    "knockout_results": "complete",
    "grand_finals": "missing"
  },
  "champion": null,
  "qualifier": [
    {
      "rank": 1,
      "name": "koeee",
      "title": "魅力之星",
      "time": "04:26.4"
    },
    {
      "rank": 2,
      "name": "o月亮惹的禍o",
      "title": "課金",
      "time": "04:41.0"
    },
    {
      "rank": 3,
      "name": "Cashasy",
      "title": "洞察先機",
      "time": "04:43.7"
    },
    {
      "rank": 4,
      "name": "RV297",
      "title": "洞察先機",
      "time": "04:52.1"
    },
    {
      "rank": 5,
      "name": "LD丨팡대",
      "title": "레전더리",
      "time": "04:53.8"
    },
    {
      "rank": 6,
      "name": "SuperAaron",
      "title": "洞察先機",
      "time": "04:57.2"
    },
    {
      "rank": 7,
      "name": "劍人海拉",
      "title": "戰神殿",
      "time": "04:57.2"
    },
    {
      "rank": 8,
      "name": "夜凜月",
      "title": "逆天改命",
      "time": "05:00.5"
    },
    {
      "rank": 9,
      "name": "龍×똥꼬",
      "title": "용기사",
      "time": "05:00.6"
    },
    {
      "rank": 10,
      "name": "LD丨짱구",
      "title": "洞察先機",
      "time": "05:03.6"
    },
    {
      "rank": 11,
      "name": "仔仔團奧奧",
      "title": "洞察先機",
      "time": "05:04.1"
    },
    {
      "rank": 12,
      "name": "Egø",
      "title": "洞察先機",
      "time": "05:04.4"
    },
    {
      "rank": 13,
      "name": "Leojian",
      "title": "洞察先機",
      "time": "05:04.5"
    },
    {
      "rank": 14,
      "name": "doityourself",
      "title": "洞察先機",
      "time": "05:04.7"
    },
    {
      "rank": 15,
      "name": "紅桃A",
      "title": "逆天改命",
      "time": "05:05.1"
    },
    {
      "rank": 16,
      "name": "I매I우연",
      "title": "洞察先機",
      "time": "05:06.5"
    },
    {
      "rank": 17,
      "name": "烏薩奇Usagi",
      "title": "洞察先機",
      "time": "05:07.2"
    },
    {
      "rank": 18,
      "name": "龍×식현",
      "title": "용기사",
      "time": "05:08.2"
    },
    {
      "rank": 19,
      "name": "메투스",
      "title": "洞察先機",
      "time": "05:08.3"
    },
    {
      "rank": 20,
      "name": "I매IFLEX3R",
      "title": "洞察先機",
      "time": "05:08.6"
    },
    {
      "rank": 21,
      "name": "賽博陀螺",
      "title": "洞察先機",
      "time": "05:08.7"
    },
    {
      "rank": 22,
      "name": "I매I똥꼬",
      "title": "洞察先機",
      "time": "05:09.1"
    },
    {
      "rank": 23,
      "name": "巴嗝鴨肉",
      "title": "洞察先機",
      "time": "05:09.1"
    },
    {
      "rank": 24,
      "name": "Niff",
      "title": "洞察先機",
      "time": "05:09.6"
    },
    {
      "rank": 25,
      "name": "龍×이뮤",
      "title": "용기사",
      "time": "05:09.9"
    },
    {
      "rank": 26,
      "name": "阿武花豆",
      "title": "課金",
      "time": "05:14.4"
    },
    {
      "rank": 27,
      "name": "戰神子龍",
      "title": "洞察先機",
      "time": "05:14.8"
    },
    {
      "rank": 28,
      "name": "放開隻牛仔",
      "title": "洞察先機",
      "time": "05:16.5"
    },
    {
      "rank": 29,
      "name": "I매I네이비",
      "title": "洞察先機",
      "time": "05:17.1"
    },
    {
      "rank": 30,
      "name": "戰神角角",
      "title": "逆天改命",
      "time": "05:17.6"
    },
    {
      "rank": 31,
      "name": "牛大力",
      "title": "課金",
      "time": "05:18.0"
    },
    {
      "rank": 32,
      "name": "牛大力",
      "title": "巔峰之上",
      "time": "05:19.0"
    },
    {
      "rank": 33,
      "name": "FLEX2R fx",
      "title": "FLEX",
      "time": "05:20.9"
    },
    {
      "rank": 34,
      "name": "욕정",
      "title": "逆天改命",
      "time": "05:21.2"
    },
    {
      "rank": 35,
      "name": "Makabaka",
      "title": "洞察先機",
      "time": "05:21.7"
    },
    {
      "rank": 36,
      "name": "龍×교슈",
      "title": "용기사",
      "time": "05:22.7"
    },
    {
      "rank": 37,
      "name": "牛大力",
      "title": "逆天改命",
      "time": "05:22.7"
    },
    {
      "rank": 38,
      "name": "I매I일여행중",
      "title": "매",
      "time": "05:22.8"
    },
    {
      "rank": 39,
      "name": "戰神蕉蕉",
      "title": "逆天改命",
      "time": "05:23.1"
    },
    {
      "rank": 40,
      "name": "龍×조이",
      "title": "용기사",
      "time": "05:24.7"
    },
    {
      "rank": 41,
      "name": "I매I똥꼬",
      "title": "洞察先機",
      "time": "05:25.0"
    },
    {
      "rank": 42,
      "name": "泰融",
      "title": "逆天改命",
      "time": "05:25.9"
    },
    {
      "rank": 43,
      "name": "瑪法里恩中風",
      "title": "姒神",
      "time": "05:26.9"
    },
    {
      "rank": 44,
      "name": "I매I진",
      "title": "洞察先機",
      "time": "05:27.5"
    },
    {
      "rank": 45,
      "name": "龍×콰트",
      "title": "용기사",
      "time": "05:27.6"
    },
    {
      "rank": 46,
      "name": "丫丸仔",
      "title": "逆天改命",
      "time": "05:27.6"
    },
    {
      "rank": 47,
      "name": "龍×령녀",
      "title": "용기사",
      "time": "05:27.6"
    },
    {
      "rank": 48,
      "name": "I매I연인",
      "title": "洞察先機",
      "time": "05:28.0"
    },
    {
      "rank": 49,
      "name": "仔仔團宗宗",
      "title": "逆天改命",
      "time": "05:28.8"
    },
    {
      "rank": 50,
      "name": "紫薯芋泥c",
      "title": "逆天改命",
      "time": "05:29.3"
    },
    {
      "rank": 51,
      "name": "CoBe",
      "title": "逆天改命",
      "time": "05:31.2"
    },
    {
      "rank": 52,
      "name": "LD丨말랭",
      "title": "洞察先機",
      "time": "05:31.9"
    },
    {
      "rank": 53,
      "name": "戰神大叔o",
      "title": "洞察先機",
      "time": "05:32.5"
    },
    {
      "rank": 54,
      "name": "고른주부J",
      "title": "고른햇살",
      "time": "05:32.5"
    },
    {
      "rank": 55,
      "name": "龍×냥코",
      "title": "용기사",
      "time": "05:32.7"
    },
    {
      "rank": 56,
      "name": "龍騎士神さま",
      "title": "洞察先機",
      "time": "05:33.2"
    },
    {
      "rank": 57,
      "name": "LD丨팡대ㅇ③",
      "title": "레전더리",
      "time": "05:33.4"
    },
    {
      "rank": 58,
      "name": "I매I사냥",
      "title": "洞察先機",
      "time": "05:33.6"
    },
    {
      "rank": 59,
      "name": "I매I루아흐",
      "title": "洞察先機",
      "time": "05:33.9"
    },
    {
      "rank": 60,
      "name": "戰神SAKE",
      "title": "洞察先機",
      "time": "05:34.2"
    },
    {
      "rank": 61,
      "name": "Yöö fx",
      "title": "FLEX",
      "time": "05:34.2"
    },
    {
      "rank": 62,
      "name": "I매I인써하",
      "title": "逆天改命",
      "time": "05:34.8"
    },
    {
      "rank": 63,
      "name": "頭殼芭蕊",
      "title": "逆天改命",
      "time": "05:35.1"
    },
    {
      "rank": 64,
      "name": "LD丨도하",
      "title": "레전더리",
      "time": "05:35.2"
    },
    {
      "rank": 65,
      "name": "단별ll헌큐",
      "title": "洞察先機",
      "time": "05:36.5"
    },
    {
      "rank": 66,
      "name": "I매I롱",
      "title": "洞察先機",
      "time": "05:36.7"
    },
    {
      "rank": 67,
      "name": "I매I심쿵Dad",
      "title": "洞察先機",
      "time": "05:37.7"
    },
    {
      "rank": 68,
      "name": "螞蟻王子",
      "title": "洞察先機",
      "time": "05:38.9"
    },
    {
      "rank": 69,
      "name": "戰神彬彬",
      "title": "戰神殿",
      "time": "05:39.1"
    },
    {
      "rank": 70,
      "name": "LD丨저축왕",
      "title": "洞察先機",
      "time": "05:41.5"
    }
  ],
  "groups": [
    {
      "id": 1,
      "players": [
        {
          "name": "龍×과트",
          "power": "12.25M",
          "qualifier_time": "05:27.6",
          "prev_power": "10.98M",
          "prev_progress": "10/10",
          "prev_time": "03:03.42"
        },
        {
          "name": "戰神大叔o",
          "power": "11.73M",
          "qualifier_time": "05:32.5",
          "prev_power": "11.30M",
          "prev_progress": "10/10",
          "prev_time": "05:25.05"
        },
        {
          "name": "RV297",
          "power": "25.50M",
          "qualifier_time": "04:52.1",
          "prev_power": "24.20M",
          "prev_progress": "10/10",
          "prev_time": "02:35.66"
        },
        {
          "name": "戰神子龍",
          "power": "21.01M",
          "qualifier_time": "05:14.8",
          "prev_power": "13.31M",
          "prev_progress": "10/10",
          "prev_time": "04:44.19"
        },
        {
          "name": "I매I인써하",
          "power": "8.97M",
          "qualifier_time": "05:34.8"
        },
        {
          "name": "I매IFLEX3R",
          "power": "27.05M",
          "qualifier_time": "05:08.6",
          "prev_power": "22.65M",
          "prev_progress": "10/10",
          "prev_time": "03:07.22"
        },
        {
          "name": "욕정",
          "power": "16.83M",
          "qualifier_time": "05:21.2",
          "prev_power": "14.05M",
          "prev_progress": "10/10",
          "prev_time": "06:18.37"
        },
        {
          "name": "doityourself",
          "power": "31.63M",
          "qualifier_time": "05:04.7",
          "prev_power": "28.73M",
          "prev_progress": "10/10",
          "prev_time": "01:46.10"
        }
      ],
      "champion": "doityourself",
      "runner_up": "I매IFLEX3R",
      "champion_power": "8.55M",
      "champion_current_power": "32.97M",
      "matches": [
        {
          "round": "R1",
          "slot": "A",
          "p1": {
            "name": "戰神大叔o",
            "progress": 10,
            "time": "10:00.02",
            "power": "11.34M"
          },
          "p2": {
            "name": "龍×콰트",
            "progress": 10,
            "time": "10:00.02",
            "power": "10.49M"
          },
          "winner": "戰神大叔o",
          "loser": "龍×콰트",
          "notes": [
            "雙方滿時，判定勝負"
          ]
        },
        {
          "round": "R1",
          "slot": "B",
          "p1": {
            "name": "RV297",
            "progress": 10,